Author/Year,Paper Title,Description
"Bruce et al. <a href=""#ref-bruce2014"" role=""doc-biblioref"">(2014)</a>","Hydrodynamic controls on oxygen dynamics in a riverine salt wedge estuary, the Yarra River estuary, Australia.",
"Bruce et al. <a href=""#ref-bruce2015"" role=""doc-biblioref"">(2015)</a>",A model of oxygen and nitrogen biogeochemical response to hydrodynamic regimes in the Yarra River estuary.,
Snortheim et al. (2017) ," ""Meteorological drivers of hypolimnetic anoxia in a eutrophic"," north temperate lake."""
"Huang et al. <a href=""#ref-huang2019"" role=""doc-biblioref"">(2018)</a>",Assessing artificial oxygenation in a riverine salt-wedge estuary with a three-dimensional finite-volume model,
"Huang et al. <a href=""#ref-huang2019"" role=""doc-biblioref"">(2019)</a>",An integrated modelling system for water quality forecasting in an urban eutrophic estuary: The Swan-Canning Estuary Virtual Observatory.,
Ladwig et al. (2021),Lake thermal structure drives interannual variability in summer anoxia dynamics in a eutrophic lake over 37 years.,
Carey et al. (2022),"Anoxia decreases the magnitude of the carbon, nitrogen, and phosphorus sink in freshwaters",
Farrell et al. (2020),Ecosystem-scale nutrient cycling responses to increasing air temperatures vary with lake trophic state,
Ward et al. (2020),Differential responses of maximum and median chlorophyll-a to air temperature and nutrient load in a 31-year oligotrophic lake simulation,